{
  "$schema": "https://json-schema.org/draft/2020-12/schema",
  "$id": "https://fixoa.github.io/crackspread/schemas/shipping.schema.json",
  "title": "shipping.json",
  "description": "IMF PortWatch daily chokepoint transits, averaged over the last days and compared with the previous year.",
  "type": "object",
  "required": ["schema_version", "generated_at", "as_of", "fetched_at", "stale", "source", "source_url", "unit", "window_days", "baseline_year", "chokepoints"],
  "properties": {
    "schema_version": {"const": 1},
    "generated_at": {"$ref": "#/$defs/timestamp"},
    "as_of": {"$ref": "#/$defs/date"},
    "fetched_at": {"$ref": "#/$defs/timestamp"},
    "stale": {"type": "boolean"},
    "source": {"type": "string", "minLength": 1},
    "source_url": {"type": "string", "pattern": "^https?://\\S+$"},
    "licence": {"type": "string"},
    "unit": {"type": "string", "minLength": 1},
    "window_days": {"type": "integer", "minimum": 1},
    "baseline_year": {"type": "integer"},
    "chokepoints": {
      "type": "array",
      "items": {
        "type": "object",
        "required": ["id", "portid", "name", "latest_date", "tankers_7d", "tankers_baseline", "tankers_change_pct"],
        "properties": {
          "id": {"type": "string", "minLength": 1},
          "portid": {"type": "string", "minLength": 1},
          "name": {"type": "string", "minLength": 1},
          "latest_date": {"anyOf": [{"$ref": "#/$defs/date"}, {"type": "null"}]},
          "tankers_7d": {"type": ["number", "null"]},
          "tankers_baseline": {"type": ["number", "null"]},
          "tankers_change_pct": {"type": ["number", "null"]},
          "total_7d": {"type": ["number", "null"]},
          "total_baseline": {"type": ["number", "null"]},
          "capacity_tanker_7d": {"type": ["number", "null"]},
          "series": {
            "type": "object",
            "required": ["weeks", "tankers"],
            "properties": {
              "weeks": {"type": "array", "items": {"type": "string", "pattern": "^\\d{4}-W\\d{2}$"}},
              "tankers": {"type": "array", "items": {"type": ["number", "null"]}}
            }
          }
        },
        "additionalProperties": true
      }
    }
  },
  "additionalProperties": true,
  "$defs": {
    "timestamp": {"type": "string", "pattern": "^\\d{4}-\\d{2}-\\d{2}T\\d{2}:\\d{2}:\\d{2}Z$"},
    "date": {"type": "string", "pattern": "^\\d{4}-\\d{2}-\\d{2}$"}
  }
}
