{
 "as_of": "2026-10-04",
 "baseline_year": 2025,
 "chokepoints": [
  {
   "capacity_tanker_7d": 16270.6,
   "id": "hormuz",
   "latest_date": "2026-10-04",
   "name": "Strait of Hormuz",
   "portid": "chokepoint6",
   "series": {
    "tankers": [
     38.6,
     38.6,
     38.6,
     42.3,
     39.6,
     38.0,
     48.7,
     43.6,
     34.6,
     51.6,
     47.1,
     49.1,
     47.6,
     61.7,
     57.7,
     48.0,
     62.9,
     56.0,
     55.1,
     60.7,
     60.7,
     55.3,
     55.3,
     60.6,
     58.3,
     58.6,
     51.4,
     52.1,
     58.3,
     52.6,
     54.9,
     43.9,
     60.4,
     54.3,
     54.6,
     55.1,
     41.4,
     50.1,
     48.9,
     64.9,
     35.6,
     40.1,
     58.1,
     50.1,
     43.6,
     44.4,
     34.9,
     30.0,
     32.3,
     31.1,
     25.7,
     30.3,
     31.3,
     34.3,
     28.7,
     30.7,
     30.9,
     33.7,
     43.1,
     52.7,
     42.3,
     0.6,
     0.6,
     0.4,
     1.1,
     2.1,
     1.9,
     4.0,
     1.7,
     5.6,
     0.4,
     2.0,
     1.9,
     0.4,
     1.1,
     0.9,
     4.4,
     14.0,
     13.3,
     6.4,
     2.3,
     0.9,
     1.4,
     1.9,
     1.6,
     2.4,
     1.9,
     0.9,
     1.4,
     0.6,
     1.3,
     0.9
    ],
    "weeks": [
     "2025-W01",
     "2025-W02",
     "2025-W03",
     "2025-W04",
     "2025-W05",
     "2025-W06",
     "2025-W07",
     "2025-W08",
     "2025-W09",
     "2025-W10",
     "2025-W11",
     "2025-W12",
     "2025-W13",
     "2025-W14",
     "2025-W15",
     "2025-W16",
     "2025-W17",
     "2025-W18",
     "2025-W19",
     "2025-W20",
     "2025-W21",
     "2025-W22",
     "2025-W23",
     "2025-W24",
     "2025-W25",
     "2025-W26",
     "2025-W27",
     "2025-W28",
     "2025-W29",
     "2025-W30",
     "2025-W31",
     "2025-W32",
     "2025-W33",
     "2025-W34",
     "2025-W35",
     "2025-W36",
     "2025-W37",
     "2025-W38",
     "2025-W39",
     "2025-W40",
     "2025-W41",
     "2025-W42",
     "2025-W43",
     "2025-W44",
     "2025-W45",
     "2025-W46",
     "2025-W47",
     "2025-W48",
     "2025-W49",
     "2025-W50",
     "2025-W51",
     "2025-W52",
     "2026-W01",
     "2026-W02",
     "2026-W03",
     "2026-W04",
     "2026-W05",
     "2026-W06",
     "2026-W07",
     "2026-W08",
     "2026-W09",
     "2026-W10",
     "2026-W11",
     "2026-W12",
     "2026-W13",
     "2026-W14",
     "2026-W15",
     "2026-W16",
     "2026-W17",
     "2026-W18",
     "2026-W19",
     "2026-W20",
     "2026-W21",
     "2026-W22",
     "2026-W23",
     "2026-W24",
     "2026-W25",
     "2026-W26",
     "2026-W27",
     "2026-W28",
     "2026-W29",
     "2026-W30",
     "2026-W31",
     "2026-W32",
     "2026-W33",
     "2026-W34",
     "2026-W35",
     "2026-W36",
     "2026-W37",
     "2026-W38",
     "2026-W39",
     "2026-W40"
    ]
   },
   "tankers_7d": 0.9,
   "tankers_baseline": 48.2,
   "tankers_change_pct": -98.0,
   "total_7d": 2.7,
   "total_baseline": 85.5,
   "window_days": 7
  },
  {
   "capacity_tanker_7d": 443549.0,
   "id": "bab_el_mandeb",
   "latest_date": "2026-10-04",
   "name": "Bab el-Mandeb",
   "portid": "chokepoint4",
   "series": {
    "tankers": [
     8.2,
     11.3,
     11.0,
     10.7,
     10.7,
     10.3,
     11.0,
     11.1,
     10.9,
     10.6,
     12.0,
     13.4,
     11.3,
     12.1,
     13.7,
     10.4,
     10.9,
     11.3,
     11.1,
     11.0,
     11.9,
     11.0,
     11.6,
     12.1,
     11.7,
     10.3,
     11.9,
     12.7,
     9.7,
     10.6,
     10.4,
     14.1,
     9.7,
     8.7,
     12.6,
     10.0,
     11.4,
     10.7,
     12.3,
     11.6,
     13.9,
     11.1,
     12.3,
     11.1,
     15.4,
     11.3,
     13.0,
     12.7,
     11.4,
     9.9,
     12.6,
     11.3,
     11.0,
     13.0,
     10.1,
     11.3,
     13.3,
     12.1,
     13.6,
     15.3,
     14.1,
     13.1,
     14.0,
     18.1,
     14.9,
     16.0,
     15.4,
     14.0,
     13.9,
     13.7,
     12.9,
     12.6,
     16.6,
     13.4,
     14.4,
     13.7,
     15.0,
     12.3,
     11.9,
     12.3,
     15.1,
     8.4,
     9.0,
     8.7,
     8.9,
     9.7,
     8.0,
     7.0,
     8.1,
     6.6,
     9.4,
     9.0
    ],
    "weeks": [
     "2025-W01",
     "2025-W02",
     "2025-W03",
     "2025-W04",
     "2025-W05",
     "2025-W06",
     "2025-W07",
     "2025-W08",
     "2025-W09",
     "2025-W10",
     "2025-W11",
     "2025-W12",
     "2025-W13",
     "2025-W14",
     "2025-W15",
     "2025-W16",
     "2025-W17",
     "2025-W18",
     "2025-W19",
     "2025-W20",
     "2025-W21",
     "2025-W22",
     "2025-W23",
     "2025-W24",
     "2025-W25",
     "2025-W26",
     "2025-W27",
     "2025-W28",
     "2025-W29",
     "2025-W30",
     "2025-W31",
     "2025-W32",
     "2025-W33",
     "2025-W34",
     "2025-W35",
     "2025-W36",
     "2025-W37",
     "2025-W38",
     "2025-W39",
     "2025-W40",
     "2025-W41",
     "2025-W42",
     "2025-W43",
     "2025-W44",
     "2025-W45",
     "2025-W46",
     "2025-W47",
     "2025-W48",
     "2025-W49",
     "2025-W50",
     "2025-W51",
     "2025-W52",
     "2026-W01",
     "2026-W02",
     "2026-W03",
     "2026-W04",
     "2026-W05",
     "2026-W06",
     "2026-W07",
     "2026-W08",
     "2026-W09",
     "2026-W10",
     "2026-W11",
     "2026-W12",
     "2026-W13",
     "2026-W14",
     "2026-W15",
     "2026-W16",
     "2026-W17",
     "2026-W18",
     "2026-W19",
     "2026-W20",
     "2026-W21",
     "2026-W22",
     "2026-W23",
     "2026-W24",
     "2026-W25",
     "2026-W26",
     "2026-W27",
     "2026-W28",
     "2026-W29",
     "2026-W30",
     "2026-W31",
     "2026-W32",
     "2026-W33",
     "2026-W34",
     "2026-W35",
     "2026-W36",
     "2026-W37",
     "2026-W38",
     "2026-W39",
     "2026-W40"
    ]
   },
   "tankers_7d": 9.0,
   "tankers_baseline": 11.5,
   "tankers_change_pct": -22.0,
   "total_7d": 29.6,
   "total_baseline": 33.5,
   "window_days": 7
  },
  {
   "capacity_tanker_7d": 865425.9,
   "id": "suez",
   "latest_date": "2026-10-04",
   "name": "Suez Canal",
   "portid": "chokepoint1",
   "series": {
    "tankers": [
     12.8,
     11.6,
     14.1,
     12.0,
     14.3,
     10.3,
     13.9,
     12.4,
     12.4,
     13.6,
     14.7,
     13.9,
     17.4,
     13.6,
     16.6,
     14.6,
     12.1,
     13.7,
     13.6,
     13.6,
     17.0,
     14.1,
     13.3,
     17.0,
     13.7,
     14.6,
     15.4,
     15.3,
     15.0,
     15.4,
     15.3,
     15.0,
     15.3,
     15.9,
     13.3,
     15.3,
     16.7,
     15.9,
     16.9,
     15.6,
     15.1,
     14.9,
     16.0,
     13.9,
     16.4,
     15.4,
     13.4,
     15.6,
     15.1,
     15.7,
     17.6,
     14.1,
     14.0,
     12.4,
     15.3,
     14.6,
     15.9,
     16.9,
     17.0,
     18.0,
     17.7,
     18.1,
     15.4,
     16.6,
     17.9,
     19.9,
     18.1,
     15.6,
     17.4,
     14.4,
     17.6,
     16.4,
     16.9,
     15.9,
     15.1,
     13.9,
     16.3,
     17.1,
     16.0,
     15.0,
     17.1,
     15.4,
     14.6,
     15.6,
     16.9,
     16.4,
     17.1,
     15.3,
     15.9,
     17.0,
     15.0,
     15.6
    ],
    "weeks": [
     "2025-W01",
     "2025-W02",
     "2025-W03",
     "2025-W04",
     "2025-W05",
     "2025-W06",
     "2025-W07",
     "2025-W08",
     "2025-W09",
     "2025-W10",
     "2025-W11",
     "2025-W12",
     "2025-W13",
     "2025-W14",
     "2025-W15",
     "2025-W16",
     "2025-W17",
     "2025-W18",
     "2025-W19",
     "2025-W20",
     "2025-W21",
     "2025-W22",
     "2025-W23",
     "2025-W24",
     "2025-W25",
     "2025-W26",
     "2025-W27",
     "2025-W28",
     "2025-W29",
     "2025-W30",
     "2025-W31",
     "2025-W32",
     "2025-W33",
     "2025-W34",
     "2025-W35",
     "2025-W36",
     "2025-W37",
     "2025-W38",
     "2025-W39",
     "2025-W40",
     "2025-W41",
     "2025-W42",
     "2025-W43",
     "2025-W44",
     "2025-W45",
     "2025-W46",
     "2025-W47",
     "2025-W48",
     "2025-W49",
     "2025-W50",
     "2025-W51",
     "2025-W52",
     "2026-W01",
     "2026-W02",
     "2026-W03",
     "2026-W04",
     "2026-W05",
     "2026-W06",
     "2026-W07",
     "2026-W08",
     "2026-W09",
     "2026-W10",
     "2026-W11",
     "2026-W12",
     "2026-W13",
     "2026-W14",
     "2026-W15",
     "2026-W16",
     "2026-W17",
     "2026-W18",
     "2026-W19",
     "2026-W20",
     "2026-W21",
     "2026-W22",
     "2026-W23",
     "2026-W24",
     "2026-W25",
     "2026-W26",
     "2026-W27",
     "2026-W28",
     "2026-W29",
     "2026-W30",
     "2026-W31",
     "2026-W32",
     "2026-W33",
     "2026-W34",
     "2026-W35",
     "2026-W36",
     "2026-W37",
     "2026-W38",
     "2026-W39",
     "2026-W40"
    ]
   },
   "tankers_7d": 15.6,
   "tankers_baseline": 14.6,
   "tankers_change_pct": 7.0,
   "total_7d": 43.1,
   "total_baseline": 38.5,
   "window_days": 7
  },
  {
   "capacity_tanker_7d": 1033075.0,
   "id": "cape",
   "latest_date": "2026-10-04",
   "name": "Cape of Good Hope",
   "portid": "chokepoint7",
   "series": {
    "tankers": [
     18.6,
     15.3,
     15.3,
     16.9,
     11.3,
     16.9,
     15.4,
     15.9,
     18.1,
     15.1,
     14.6,
     12.3,
     16.3,
     15.3,
     19.0,
     17.0,
     16.4,
     14.7,
     17.4,
     19.9,
     15.6,
     17.9,
     17.1,
     16.9,
     16.7,
     14.7,
     17.0,
     18.0,
     17.4,
     15.7,
     19.7,
     18.4,
     19.4,
     18.1,
     18.4,
     16.0,
     18.3,
     20.9,
     18.1,
     19.1,
     18.7,
     16.0,
     21.9,
     16.9,
     14.9,
     15.7,
     18.0,
     18.3,
     15.9,
     13.9,
     17.3,
     16.0,
     17.3,
     14.4,
     16.9,
     16.7,
     17.1,
     11.9,
     14.6,
     14.9,
     12.3,
     12.7,
     15.7,
     19.3,
     23.7,
     21.1,
     23.0,
     26.0,
     22.3,
     20.7,
     19.4,
     24.1,
     22.4,
     18.7,
     21.3,
     18.0,
     21.1,
     20.3,
     17.0,
     17.7,
     17.0,
     17.9,
     20.1,
     19.9,
     20.3,
     20.1,
     19.7,
     15.7,